{
  "voice": "steenbarger",
  "date": "2026-07-22",
  "universe_file": "/home/claude/AQE/aegis/data/sod/2026-07-22/universe.json",
  "nominations": [
    {
      "ticker": "BSX",
      "reason": "Cleanest process in the book: zero lens warnings, no divergence, momentum leadership with orderly participation (rvol 1.28) — survives the ticker-hidden test on signals alone.",
      "fields_cited": ["sc_momentum", "lens_warnings", "div_state", "rvol"],
      "conviction": 4,
      "price_at_nomination": null
    },
    {
      "ticker": "PGR",
      "reason": "The textbook uncomfortable-but-sound setup: bullish divergence (downmove losing internal energy) with zero warnings and CALM participation (rvol 0.94, no crowd froth) — a non-consensus Financials name, not a chase.",
      "fields_cited": ["div_state", "lens_warnings", "rvol", "sc_momentum"],
      "conviction": 4,
      "price_at_nomination": null
    },
    {
      "ticker": "LLY",
      "reason": "High momentum with clean lenses (1 warning) and no divergence; participation firm but not frantic (rvol 1.34) — process holds up, diversifies away from the IT crowd.",
      "fields_cited": ["sc_momentum", "lens_warnings", "div_state", "rvol"],
      "conviction": 4,
      "price_at_nomination": null
    },
    {
      "ticker": "NFLX",
      "reason": "Steady momentum, single lens warning, no divergence, and near-average participation (rvol 1.09) — an unhurried, well-behaved tape rather than an excited one.",
      "fields_cited": ["sc_momentum", "lens_warnings", "div_state", "rvol"],
      "conviction": 3,
      "price_at_nomination": null
    },
    {
      "ticker": "AMZN",
      "reason": "Clean process (1 warning, no divergence) with orderly participation (rvol 1.18); nomination rests on signal quality, not the name — passes the confirmation guard.",
      "fields_cited": ["sc_momentum", "lens_warnings", "div_state", "rvol"],
      "conviction": 3,
      "price_at_nomination": null
    },
    {
      "ticker": "NVDA",
      "reason": "Process is genuinely clean (zero warnings, no divergence) — but this is the crowded consensus AI trade the committee least needs me to cheerlead; rvol 1.45 shows the crowd already here, so I flag the crowding and cap conviction.",
      "fields_cited": ["lens_warnings", "div_state", "rvol", "sc_momentum"],
      "conviction": 3,
      "price_at_nomination": null
    },
    {
      "ticker": "NEE",
      "reason": "Bullish divergence with a single warning and the calmest participation in the shortlist (rvol 0.87) — a quiet, non-crowded Utilities name that broadens the book away from IT.",
      "fields_cited": ["div_state", "lens_warnings", "rvol", "sc_momentum"],
      "conviction": 3,
      "price_at_nomination": null
    },
    {
      "ticker": "LIN",
      "reason": "Middling-but-clean momentum, one warning, no divergence, subdued participation (rvol 0.91) — a Materials diversifier chosen for process cleanliness, not glamour.",
      "fields_cited": ["sc_momentum", "lens_warnings", "div_state", "rvol"],
      "conviction": 3,
      "price_at_nomination": null
    }
  ],
  "held_review": [
    {"ticker": "AMPL", "verdict": "EXIT-CASE", "line": "Worst process in the book: 3 lens warnings, confirmed bearish divergence (3 oscillators), weak momentum (38.4) with elevated rvol 1.72 — crowd leaving, not exhaustion to buy."},
    {"ticker": "DDOG", "verdict": "KEEP", "line": "Clean and orderly: 1 warning, no divergence, healthy momentum, participation near normal (rvol 1.14)."},
    {"ticker": "V", "verdict": "KEEP", "line": "Steady process, single warning, no divergence, calm participation (rvol 0.89) — no reason to touch."},
    {"ticker": "SPGI", "verdict": "KEEP", "line": "Cleanest lenses among holds (0 warnings), no divergence, quiet tape (rvol 0.93) — model behaviour."},
    {"ticker": "IBM", "verdict": "EXIT-CASE", "line": "Deteriorating: momentum 42.1, 2 warnings, bearish divergence confirmed — process argues for stepping aside."},
    {"ticker": "VRSK", "verdict": "KEEP", "line": "Zero warnings, no divergence, subdued rvol 0.88 — disciplined hold, nothing to react to."},
    {"ticker": "EXEL", "verdict": "KEEP", "line": "Strong and clean: 0 warnings, no divergence, momentum 61.2 with firm participation (rvol 1.22)."},
    {"ticker": "PTRN", "verdict": "TIGHTEN", "line": "Two warnings plus a nascent bearish divergence (1 oscillator) on softening momentum — tighten risk while it proves itself."},
    {"ticker": "CHYM", "verdict": "EXIT-CASE", "line": "Weak momentum (44.9), 2 warnings, bearish divergence (2 oscillators) with elevated rvol 1.58 — reversal/exit signature."},
    {"ticker": "NTAP", "verdict": "KEEP", "line": "Passable process: 1 warning, no divergence, participation near normal (rvol 1.19) — hold, don't add."},
    {"ticker": "NU", "verdict": "TIGHTEN", "line": "Bearish divergence (2 oscillators) with elevated participation (rvol 1.41) on middling momentum — reversal risk warrants tighter stop."},
    {"ticker": "SLDE", "verdict": "KEEP", "line": "Soft momentum (46.2) but genuinely clean: 1 warning, no divergence, calm rvol 0.95 — hold on a short leash."}
  ],
  "shortfall_reason": "Only 8 nominated. Clean-process candidates that survive both the crowding guard (universe is IT-heavy; I capped my own IT and Health Care clustering) and the confirmation/behaviour guard (excluded bearish-divergence names and frenzied-rvol chases) genuinely thin out here. Padding to 10 with warning-flagged or divergence-exhaustion names would breach my process — fewer with conviction is the correct outcome."
}
