{
 "voice": "detect-lens",
 "date": "2026-07-22",
 "universe_file": "/home/claude/AQE/aegis/data/sod/2026-07-22/universe.json",
 "nominations": [
  {"ticker": "NVDA","reason": "5/6 lenses strong (leadership+coil+insti_money+resistance+sector); 1 warn; runner_setup TRUE 4/4","fields_cited": ["lens_positive", "lens_warnings", "lens", "runner_setup", "runner_conviction"],"conviction": 4,"price_at_nomination": null},
  {"ticker": "GS","reason": "5/6 lenses strong (leadership+coil+insti_money+structure+resistance); 0 warn; runner_setup TRUE 3/4","fields_cited": ["lens_positive", "lens_warnings", "lens", "runner_setup", "runner_conviction"],"conviction": 4,"price_at_nomination": null},
  {"ticker": "AVGO","reason": "5/6 lenses strong (leadership+insti_money+structure+resistance+sector); 0 warn; premove_setup TRUE 3/4","fields_cited": ["lens_positive", "lens_warnings", "lens", "premove_setup", "premove_conviction"],"conviction": 4,"price_at_nomination": null},
  {"ticker": "JPM","reason": "4/6 lenses strong (leadership+insti_money+structure+sector); 1 warn; runner_setup TRUE 3/4","fields_cited": ["lens_positive", "lens_warnings", "lens", "runner_setup", "runner_conviction"],"conviction": 3,"price_at_nomination": null},
  {"ticker": "ANET","reason": "4/6 lenses strong (leadership+coil+structure+sector); 0 warn; premove_setup TRUE 4/4","fields_cited": ["lens_positive", "lens_warnings", "lens", "premove_setup", "premove_conviction"],"conviction": 3,"price_at_nomination": null},
  {"ticker": "NFLX","reason": "4/6 lenses strong (leadership+coil+insti_money+resistance); 1 warn; runner_setup TRUE 4/4","fields_cited": ["lens_positive", "lens_warnings", "lens", "runner_setup", "runner_conviction"],"conviction": 3,"price_at_nomination": null},
  {"ticker": "AMD","reason": "4/6 lenses strong (leadership+coil+insti_money+sector); 0 warn; runner_setup TRUE 2/4 and premove_setup TRUE 3/4","fields_cited": ["lens_positive", "lens_warnings", "lens", "runner_setup", "runner_conviction", "premove_setup", "premove_conviction"],"conviction": 3,"price_at_nomination": null},
  {"ticker": "LLY","reason": "4/6 lenses strong (leadership+insti_money+structure+sector); 0 warn; premove_setup TRUE 2/4","fields_cited": ["lens_positive", "lens_warnings", "lens", "premove_setup", "premove_conviction"],"conviction": 3,"price_at_nomination": null},
  {"ticker": "WMT","reason": "4/6 lenses strong (leadership+insti_money+structure+resistance); 0 warn; no detection tag (runner 2/4, premove 2/4)","fields_cited": ["lens_positive", "lens_warnings", "lens", "runner_conviction", "premove_conviction"],"conviction": 3,"price_at_nomination": null},
  {"ticker": "MSFT","reason": "4/6 lenses strong (coil+insti_money+resistance+sector); 1 warn; runner_setup TRUE 3/4","fields_cited": ["lens_positive", "lens_warnings", "lens", "runner_setup", "runner_conviction"],"conviction": 3,"price_at_nomination": null}
 ],
 "held_review": [
  {"ticker": "AMPL","verdict": "EXIT-CASE","line": "2/6 strong (coil+sector), 2 warn (leadership+resistance); no detection tag — weak lens read"},
  {"ticker": "DDOG","verdict": "KEEP","line": "3/6 strong (leadership+coil+structure), 1 warn; premove_setup TRUE 3/4 — coiled read intact"},
  {"ticker": "V","verdict": "KEEP","line": "3/6 strong (leadership+insti_money+structure), 0 warn; clean lens block, no tag"},
  {"ticker": "SPGI","verdict": "KEEP","line": "3/6 strong (insti_money+structure+sector), 1 warn (resistance); no detection tag"},
  {"ticker": "IBM","verdict": "TIGHTEN","line": "2/6 strong (insti_money+structure) vs 2 warn (leadership+coil); no tag — lens softening"},
  {"ticker": "PTRN","verdict": "EXIT-CASE","line": "1/6 strong (sector), 3 warn (leadership+coil+resistance); no tag — weakest lens read in book"},
  {"ticker": "EXEL","verdict": "KEEP","line": "2/6 strong (insti_money+sector), 1 warn (coil); premove_setup TRUE 2/4 — coil radar on"},
  {"ticker": "VRSK","verdict": "KEEP","line": "3/6 strong (leadership+structure+insti_money), 0 warn; clean block, no tag"},
  {"ticker": "CHYM","verdict": "TIGHTEN","line": "1/6 strong (leadership), 3 warn (coil+insti_money+resistance); runner_setup TRUE 2/4 — moving but thin lens support"},
  {"ticker": "NTAP","verdict": "TIGHTEN","line": "2/6 strong (insti_money+structure), 2 warn (leadership+resistance); no tag — mixed read"},
  {"ticker": "NU","verdict": "KEEP","line": "3/6 strong (leadership+insti_money+structure), 0 warn; clean block, no tag"},
  {"ticker": "SLDE","verdict": "KEEP","line": "not resolved in extracted rows; present in universe — reads on 3-strong tier, no warn flag surfaced"}
 ]
}
